Date,Media Type,Media Outlet,Title,Link,Author,Sentiment,Desktop Readership,Mobile Readership,Total Readership,Shares,Ad Equivalency,Article Impact,SEO Impact,,,,
3/25/2024,News,www.ebiotrade.com,合成肽和微蛋白的快速折叠,http://www.ebiotrade.com/newsf/2024-3/20240322224947454.htm,,positive,37061,24288,61349,0,$115.34 ,Low,41,,China,,
3/25/2024,News,AZoLifeSciences,Nature-Inspired Approach Accelerates Folding of Cysteine-Rich Peptides for Drug Discovery,https://www.azolifesciences.com/news/20240325/Nature-Inspired-Approach-Accelerates-Folding-of-Cysteine-Rich-Peptides-for-Drug-Discovery.aspx,,positive,16041,16111,32152,0,$60.45 ,Low,47,,United Kingdom,Manchester,Manchester
3/23/2024,News,Biological Science Network,合成肽和微生物蛋白的快速折叠,https://www.jkwshk.tv/yaowen/20240323/1654702.html,,neutral,4328,13953,18281,0,$34.37 ,Low,15,,,,
3/23/2024,News,Head Topics,Researchers Develop Efficient Method for Producing Cysteine-Rich Peptides,https://headtopics.com/uk/researchers-develop-efficient-method-for-producing-49833719,,positive,13652,41322,54975,0,$103.35 ,Low,65,,Germany,,
3/23/2024,News,News Medical,Revolutionizing cysteine-rich peptide production for drug discovery,https://www.news-medical.net/news/20240322/Revolutionizing-cysteine-rich-peptide-production-for-drug-discovery.aspx,,positive,873320,2420017,3293338,1,"$6,191.48 ",Medium,75,,United Kingdom,Manchester,Manchester
3/22/2024,News,BIOENGINEER.ORG,Fast folding for synthetic peptides and microproteins,https://bioengineer.org/fast-folding-for-synthetic-peptides-and-microproteins/,by Bioengineer,positive,2269,3684,5953,1,$11.19 ,Low,46,,United States,New York,New York
3/22/2024,News,Phys.org,Fast folding for synthetic peptides and microproteins,https://phys.org/news/2024-03-fast-synthetic-peptides-microproteins.html,Science X,positive,911056,5651380,6562436,0,"$12,337.38 ",Medium,90,,United States,,
3/21/2024,News,Fluierul RO,_ Pliere rapida pentru peptide sintetice si microproteine,http://www.fluierul.ro/jsp/article/indexDisplayArticle.jsp?artid=40125&title=-pliere-rapida-pentru-peptide-sintetice-si-microproteine,,neutral,434,151,586,0,$1.10 ,Low,37,,Romania,,
,,,,,,,,,,,,,,,,,
,,,,,,,,,10029070,,"$18,854.65 ",,,,,,
